date,start ,end,sea_breeze,Elevation,Radar,Comments
2022-08-12,16:33:00,23:56:00,Y,149ft,KDIX,"Especially strong sea breeze, green dbZ, clashing against what looks like a land breeze"
2022-08-13,15:04:00,00:14:00,Y,149ft,KDIX,"Strong sea breeze, moves past KDIX"
2022-08-14,,,N,149ft,KDIX,It seems like a sea breeze but cannot see underneath the noise 
2022-08-15,,,N,149ft,KDIX,
2022-08-16,,,N,149ft,KDIX,Too noisy can't tell if it’s a sea breeze
2022-08-17,16:04:00,23:01:00,Y,149ft,KDIX,"Stays close to shoreline, then weakens around 7"
2022-08-18,14:30:00,23:32:00,Y,149ft,KDIX,"Strong sea breeze on coast, moving inland where it weakens. Makes it to PA border."
2022-08-19,,,N,149ft,KDIX,Very noisy radar data not sure.
2022-08-20,,,N,149ft,KDIX,
2022-08-21,,,N,149ft,KDIX,
2022-08-22,,,N,149ft,KDIX,Storms contaminate
2022-08-23,16:04:00,21:32:00,Y,149ft,KDIX,"Stays close to shoreline, then is pushed offshore."
2022-08-24,16:29:00,23:27:00,Y,149ft,KDIX,"Strong sea breeze, moves past KDIX"
2022-08-25,16:03:00,23:59:00,Y,149ft,KDIX,"Very strong sea breeze, might be the strongest ive ever seen. Goes all the way to PA "
2022-08-26,14:32:00,23:00:00,Y,149ft,KDIX,"Storms over, it only makes it to KDIX."
2022-08-27,,,N,149ft,KDIX,There seems like a sea breeze but it starts behind KDIX. Not sure if that would constitute as one?
2022-08-28,,,N,149ft,KDIX,
2022-08-29,,,N,149ft,KDIX,"Another day where it sems like it’s a sea breeze, but it forms behind KDIX?"
2022-08-30,,,N,149ft,KDIX,Storms contaminate
2022-08-31,,,N,149ft,KDIX,
